id,outcome,cause,text
7054-1663-6832-6665,Appointment Scheduling,[Reason],"Agent: City Medical Center, this is Sarah speaking. How can I help you?
Customer: Yes, I'm at your clinic right now for my 2 o'clock appointment with Dr. Harrison, but the front desk says I'm not in the system.
Agent: I'm very sorry to hear that. Let me look into this right away. Can you give me your full name and date of birth?
Customer: Angela Walker, date of birth April 3rd, 1975.
Agent: Thank you. When did you schedule this appointment?
Customer: I called about three weeks ago and spoke with someone. They confirmed my appointment for today at 2 PM.
Agent: I see you in our patient database, so you're definitely established with us. Let me check our scheduling log... This is odd. I can see that a reminder call was placed to you yesterday about this appointment.
Customer: Yes, I received that reminder. That's why I'm here. So what's the problem?
Agent: The appointment is showing in our reminder system but not in Dr. Harrison's actual schedule. We had a software update about two weeks ago and there may have been a synchronization error.
Customer: So what does that mean for me? I took time off work to be here.
Agent: I completely understand your frustration, and this is entirely our fault. Let me contact Dr. Harrison's nurse to see if we can accommodate you today.
Customer: Please, because I really need to see the doctor. I've been having these symptoms for over a week now.
Agent: I understand the urgency. Please hold for just one moment... Thank you for waiting. I spoke with the nurse, and Dr. Harrison can see you in about 25 minutes. He's just finishing up with his current patient.
Customer: Oh thank goodness. I was worried I'd have to reschedule and wait weeks.
Agent: No, we're going to take care of you today. I'm also seeing in your chart that you need to schedule a follow-up for next month. Would you like me to book that right now while I have you?
Customer: Yes, that would be good. I don't want this to happen again.
Agent: Absolutely. I have availability on December 5th at 10:30 AM or December 8th at 3:00 PM. Which works better?
Customer: December 5th at 10:30 works for me.
Agent: Perfect. I'm booking that now, and I'm entering it into both our scheduling system and our new patient portal to ensure there's no issue next time.
Customer: Good. Will I get a confirmation?
Agent: Yes, you'll receive both an email and a text message confirmation within the next five minutes.
Customer: Okay, great.
Agent: I've also added detailed notes to your file about what happened today so our IT department can investigate why this occurred.
Customer: I appreciate you handling this quickly.
Agent: It's the least we can do. The nurse will call you back to the exam room shortly. Again, we sincerely apologize for the confusion.
Customer: Thank you for your help.
Agent: You're welcome. Feel better!"
6016-2806-9323-1459,Appointment Scheduling,[Reason],"Agent: Thank you for calling HealthBridge. This is Hannah. How can I help you?
Customer: Hi, I have an appointment with Dr. Rodriguez next Monday at 11 AM, but I need to reschedule it. I have a work conflict.
Agent: I understand. Let me help you reschedule. Can I get your name and date of birth for verification?
Customer: It's Jack Parker, and my date of birth is 3/5/1986.
Agent: Thank you. I see your appointment here for the specialist appointment. Let me check Dr. Rodriguez's availability. When would work better for you?
Customer: Ideally sometime next week, but any day except next Monday would work.
Agent: Let me see what's available... Dr. Rodriguez has openings on next Friday at 9:30 AM. Would either of those work?
Customer: The morning time works better for me.
Agent: Perfect. I'm moving your appointment to that slot. You'll receive a confirmation email and text message with the new date and time.
Customer: Great, thank you. Will I need to do anything special for this specialist appointment?
Agent: For the specialist appointment, please arrive 15 minutes early to complete any necessary paperwork. If you're on any medications, bring a current list. Also, avoid eating for 4 hours before the appointment.
Customer: Okay, I'll make sure to do that. Thank you for your help.
Agent: You're welcome! If you need to make any changes, just give us a call at least 24 hours in advance. Is there anything else I can help you with today?
Customer: No, that's all. Thank you!"
1234-2927-7699-4284,Account Access Issues,[Reason],"Agent: Thank you for calling DigitalSupport. This is Emma. How can I assist you?
Customer: Hi, I can't log into my online banking. I reset my password last night, but when I try to use it, the system says invalid credentials.
Agent: I'm sorry you're experiencing issues accessing your account. Let me help you get this resolved. Can I verify your identity first?
Customer: Sure. My account number is 629926, and my name is Kyle Williams.
Agent: Thank you. I see your account here. It looks like there's a security hold that was triggered when you reset your password. This is a protective measure.
Customer: A security hold? I just reset my password like the system told me to. Why would that trigger a hold?
Agent: It's triggered when there are multiple password changes in a short period or when the change is made from an unrecognized device. This helps protect your account from unauthorized access.
Customer: I understand the security, but I need to access my online banking right now. How do we fix this?
Agent: I can remove the hold after we complete a quick account verification. Can you verify your security questions for me?
Customer: Yes, I can do that. [Provides verification information]
Agent: Perfect, thank you. I've verified your identity and I'm removing the security hold now. This will take about 30 seconds... Okay, the hold is removed. Try logging in now.
Customer: Let me try... Yes! It's working now. Thank you so much.
Agent: Excellent! Just to prevent this from happening again, I recommend using the same device for online banking access when possible. Is there anything else I can help you with?
Customer: No, that's all. I appreciate your help."
6343-9798-1604-6105,"Multiple Issues - Appointment, Prescription & Insurance",[Reason],"Agent: TrustFinancial. This is Ashley. How may I help you?
Customer: Hi, I need to reschedule my appointment with Dr. Martinez, get a prescription refill, and verify my insurance coverage for a procedure.
Agent: I can help with all three. Let me pull up your file. What's your date of birth?
Customer: 8/8/1986.
Agent: Thank you. I see your appointment with Dr. Martinez is next Tuesday at 2 PM. When would you like to reschedule?
Customer: Anytime next week except Tuesday or Wednesday.
Agent: I have Thursday at 10 AM or Friday at 3 PM available.
Customer: Thursday works. Now, I need a refill on my thyroid medication.
Agent: I can send that refill request to your pharmacy. Which pharmacy do you use?
Customer: Rite Aid on Main Street.
Agent: Sent. It'll be ready in 24 hours. Lastly, what procedure do you need insurance verification for?
Customer: I need to know if my insurance covers physical therapy sessions.
Agent: Let me check... Yes, your plan covers physical therapy with a $28 copay per visit, up to 37 visits per year. You'll need a referral from your primary care doctor.
Customer: Perfect. That's everything I needed. Thank you!"
3978-9475-8269-2233,Appointment Scheduling,[Reason],"Agent: Thank you for calling MediPlus. This is Michelle. How can I help you?
Customer: Hi, I have an appointment with Dr. Williams next Monday at 3:30 PM, but I need to reschedule it. another appointment was scheduled at the same time.
Agent: I understand. Let me help you reschedule. Can I get your name and date of birth for verification?
Customer: It's Gregory Moore, and my date of birth is 3/14/1975.
Agent: Thank you. I see your appointment here for the diagnostic evaluation. Let me check Dr. Williams's availability. When would work better for you?
Customer: Ideally sometime next week, but any day except next Monday would work.
Agent: Let me see what's available... Dr. Williams has openings on next Tuesday at 9:30 AM. Would either of those work?
Customer: The morning time works better for me.
Agent: Perfect. I'm moving your appointment to that slot. You'll receive a confirmation email and text message with the new date and time.
Customer: Great, thank you. Will I need to do anything special for this diagnostic evaluation?
Agent: For the diagnostic evaluation, please arrive 15 minutes early to complete any necessary paperwork. If you're on any medications, bring a current list. Also, avoid eating for 4 hours before the appointment.
Customer: Okay, I'll make sure to do that. Thank you for your help.
Agent: You're welcome! If you need to make any changes, just give us a call at least 24 hours in advance. Is there anything else I can help you with today?
Customer: No, that's all. Thank you!"
4620-8724-7977-9875,Escalation - Repeated Service Failures,[Reason],"Agent: Thank you for calling CarePoint. This is Joseph. How can I help you?
Customer: I've been trying to resolve an issue for over two weeks now and no one can tell me what's wrong. My card activations keep failing.
Agent: I'm really sorry you've been dealing with this. Let me pull up your account and see what's happening.
Customer: I've already explained this to five different people. Each time I'm told it's fixed, but it's not.
Agent: I understand your frustration. Can you provide your account number so I can review the history?
Customer: It's 1596-2553-4134. But honestly, I don't think you can help me. I need to speak with a supervisor.
Agent: I completely understand. Before I transfer you, let me quickly review your account to brief them on the situation. That way you won't have to explain everything again.
Customer: Fine, but make it quick. I've wasted enough time on this.
Agent: I'm looking at your PIN setup now. I can see you've attempted several card activations in the past over two weeks, and all have failed with error code 2205.
Customer: Yes! And nobody can tell me what that error means or how to fix it.
Agent: Error 2205 typically indicates a card reader failure. Have you recently made any changes to your activation system?
Customer: No, nothing has changed. I've been using this same activation system without problems for a long time.
Agent: That's very strange. Let me check something... I'm seeing that our system flagged your activation system for verification after a verification code last month. That's why the card activations are failing.
Customer: Why wasn't I notified about this? And why didn't the other agents see this?
Agent: I sincerely apologize. This should have been communicated to you. I can verify your activation system right now, which will resolve the issue.
Customer: I still want to speak with a supervisor. This has been incredibly frustrating and I want to file a formal complaint.
Agent: Absolutely, you have every right to speak with a supervisor. Let me get your activation system verified first so we can prevent any further issues, and then I'll transfer you directly to my supervisor."
5306-4524-7793-3870,Business Event - Product Recall,[Reason],"Agent: Thank you for calling ResortWorld Product Safety Line. This is Laura. How can I help you?
Customer: Hi, I just heard about a recall on the Pro-Line food processor. I purchased one a few months ago and I'm concerned.
Agent: Thank you for calling. Yes, we did issue a voluntary recall on that model due to blade detachment issue that poses a potential injury risk. I can help you with the recall process right away.
Customer: Is it safe to use at all? I used it just yesterday.
Agent: We recommend you stop using the product immediately and unplug it. The defect doesn't affect all units, but out of an abundance of caution, we're recalling all units from this production batch.
Customer: Okay, I'll unplug it right now. What do I need to do for the recall?
Agent: I'll need your product's serial number and proof of purchase. The serial number should be on the bottom of the unit. Do you have it handy?
Customer: Let me check... Yes, it's SN626024.
Agent: Thank you. That serial number is confirmed as part of the recalled batch. We're offering affected customers a refund and upgrade. Which would you prefer?
Customer: I'd like a replacement with a newer model if possible.
Agent: Absolutely. We'll send you our newest model at no charge, and we'll send you a prepaid shipping label to return the recalled unit. The new unit will arrive within 5-7 business days.
Customer: Thank you. Should I be worried about any safety issues from having used it?
Agent: The injury risk is primarily a concern with extended use or specific usage patterns. If you haven't experienced any issues so far, you should be fine. However, if you have any concerns, please consult with a medical professional. We take product safety very seriously and apologize for this inconvenience.
Customer: I appreciate your help and the quick response on this."
3631-7868-1079-2880,Escalation - Repeated Service Failures,[Reason],"Agent: Thank you for calling CoverageFirst. This is Brandon. How can I help you?
Customer: I've been trying to resolve an issue for over two weeks now and everyone gives me a different answer. My bill payments keep failing.
Agent: I'm really sorry you've been dealing with this. Let me pull up your account and see what's happening.
Customer: I've already explained this to six different people. Each time I'm told it's fixed, but it's not.
Agent: I understand your frustration. Can you provide your account number so I can review the history?
Customer: It's 4472-3899-8821. But honestly, I don't think you can help me. I need to speak with a supervisor.
Agent: I completely understand. Before I transfer you, let me quickly review your account to brief them on the situation. That way you won't have to explain everything again.
Customer: Fine, but make it quick. I've wasted enough time on this.
Agent: I'm looking at your payment history now. I can see you've attempted several bill payments in the past over two weeks, and all have failed with error code 9104.
Customer: Yes! And nobody can tell me what that error means or how to fix it.
Agent: Error 9104 typically indicates a auto-pay setup failure. Have you recently made any changes to your payment methods?
Customer: No, nothing has changed. I've been using this same payment methods without problems for a long time.
Agent: That's very strange. Let me check something... I'm seeing that our system flagged your payment methods for verification after a billing cycle last month. That's why the bill payments are failing.
Customer: Why wasn't I notified about this? And why didn't the other agents see this?
Agent: I sincerely apologize. This should have been communicated to you. I can verify your payment methods right now, which will resolve the issue.
Customer: I still want to speak with a supervisor. This has been incredibly frustrating and I want to file a formal complaint.
Agent: Absolutely, you have every right to speak with a supervisor. Let me get your payment methods verified first so we can prevent any further issues, and then I'll transfer you directly to my supervisor."
3885-5970-9447-5868,"Multiple Issues - Order Status, Billing & Account",[Reason],"Agent: Thank you for calling SoftwarePro. This is Joshua. How can I help?
Customer: Hi, I need to check on order 5764428 - it says shipped but hasn't arrived. Also, I was charged twice on my card, and I need to update my email address.
Agent: I can help with all three of those. Let me pull up your order. Can I get your account email?
Customer: It's currently sarah.garcia@oldmail.com, but I want to change it to sarah.garcia@newmail.com.
Agent: Perfect. I see order 5764428 for the wireless headphones. It was shipped three days ago via FedEx and is currently in transit. Expected delivery is tomorrow.
Customer: Okay good. But what about the duplicate charge? I see two charges of $59.99 on my statement.
Agent: Let me check your payment history... I see the issue. One was an authorization hold that should have dropped off. I'll escalate this to our billing team to release that hold immediately.
Customer: How long until I see that money back?
Agent: The hold will be released today, and depending on your bank, you should see it back within 1-3 business days. Now let me update your email to sarah.garcia@newmail.com.
Customer: Done. You'll receive a confirmation at your new email. Anything else?
Customer: No, that covers everything. Thank you!"
9707-9388-4459-4210,Claim Denials,[Reason],"Agent: Thank you for calling GuardianPolicy. This is Jennifer. How may I help you?
Customer: I received a denial letter for a medical claim and I'm really confused because I know this procedure is covered under my plan. It was for a MRI scan for my knee.
Agent: I'm sorry to hear about the denial. I'll be happy to review this with you. Can I get your member ID number?
Customer: It's 10671263. The claim number is 753346.
Agent: Thank you. Let me pull up your claim... I see the claim for the MRI scan. According to the notes, it was denied due to lack of pre-authorization.
Customer: But my doctor said everything was submitted correctly. They've done this many times before with your company.
Agent: I understand your frustration. Let me check the details... I'm looking at what was submitted. It appears the pre-authorization documentation was submitted, but it was submitted three days after the procedure was performed.
Customer: So it was denied just because of timing? That seems really unfair. I was in pain and needed the MRI scan right away.
Agent: I completely understand. In cases where there's a medical emergency or urgent medical necessity, we can file an appeal. Did your doctor document that this was urgent or causing significant pain?
Customer: Yes, absolutely. I had been dealing with severe knee pain for weeks, and it was affecting my ability to work.
Agent: That's important information. What I can do is initiate a pre-authorization appeal for you right now. I'll need to get some documentation from your provider's office, but this type of appeal usually has a good chance of approval.
Customer: How long will that take?
Agent: The appeal process typically takes 30 business days, but I can request an expedited review which would be 72 hours. In the meantime, please don't pay the bill - wait for the appeal decision.
Customer: Okay, thank you. I was worried I'd be stuck with a huge bill.
Agent: You're welcome. I'm sending the appeal request now, and you'll receive a confirmation email. I'll also note that you were experiencing significant pain requiring urgent diagnostic imaging. Is there anything else I can help clarify?"
5212-2734-3473-2598,"Multiple Issues - Appointment, Prescription & Insurance",[Reason],"Agent: HealthFirst. This is Nicole. How may I help you?
Customer: Hi, I need to reschedule my appointment with Dr. Anderson, get a prescription refill, and verify my insurance coverage for a procedure.
Agent: I can help with all three. Let me pull up your file. What's your date of birth?
Customer: 1/8/1974.
Agent: Thank you. I see your appointment with Dr. Anderson is next Tuesday at 2 PM. When would you like to reschedule?
Customer: Anytime next week except Tuesday or Wednesday.
Agent: I have Thursday at 10 AM or Friday at 3 PM available.
Customer: Thursday works. Now, I need a refill on my blood pressure medication.
Agent: I can send that refill request to your pharmacy. Which pharmacy do you use?
Customer: CVS on Main Street.
Agent: Sent. It'll be ready in 24 hours. Lastly, what procedure do you need insurance verification for?
Customer: I need to know if my insurance covers physical therapy sessions.
Agent: Let me check... Yes, your plan covers physical therapy with a $21 copay per visit, up to 24 visits per year. You'll need a referral from your primary care doctor.
Customer: Perfect. That's everything I needed. Thank you!"
6059-9858-6381-4834,Fraud Alert Investigation,[Reason],"Agent: Thank you for calling MetroFinance Fraud Department. This is Ashley. How can I help you?
Customer: I just got a fraud alert about a charge on my account. I wanted to verify if it's legitimate.
Agent: Absolutely, I can help you with that. Can I get your card number and verify your identity?
Customer: Sure, the last four digits are 6580. My name is Charles Diaz.
Agent: Thank you. I see the alert on your account. There's a charge for $1,245.00 at a restaurant in New York. Did you make this purchase?
Customer: No, I definitely did not. I've never been to New York, and I haven't made any online purchases recently.
Agent: Understood. I'm marking this transaction as fraudulent right now and blocking your current card. The charge will be reversed within 5-7 business days.
Customer: Thank you. How did someone get my card information?
Agent: Unfortunately, card information can be compromised in several ways - data breaches, skimming devices, or phishing. The important thing is we caught it quickly. I'm issuing you a new card with expedited shipping. You should receive it in 2-3 business days.
Customer: What about my automatic payments? I have bills set up on this card.
Agent: Good question. I recommend updating those as soon as you receive your new card. In the meantime, I can note which merchants you have recurring payments with, and we'll ensure those go through while we transition you to the new card.
Customer: Okay, thank you. Is there anything else I should do?
Agent: I recommend monitoring your account closely for the next few weeks. We've also added extra security monitoring. If you see anything suspicious, call us immediately. Is there anything else I can help you with?
Customer: No, that's all. Thank you for your help."
5384-3322-6756-1435,Fraud Alert Investigation,[Reason],"Agent: Thank you for calling SecureLife Fraud Department. This is Nicole. How can I help you?
Customer: I just got a fraud alert about a charge on my account. I wanted to verify if it's legitimate.
Agent: Absolutely, I can help you with that. Can I get your card number and verify your identity?
Customer: Sure, the last four digits are 3050. My name is Joseph Cook.
Agent: Thank you. I see the alert on your account. There's a charge for $623.99 at a hotel in Nevada. Did you make this purchase?
Customer: No, I definitely did not. I've never been to Nevada, and I haven't made any online purchases recently.
Agent: Understood. I'm marking this transaction as fraudulent right now and blocking your current card. The charge will be reversed within 5-7 business days.
Customer: Thank you. How did someone get my card information?
Agent: Unfortunately, card information can be compromised in several ways - data breaches, skimming devices, or phishing. The important thing is we caught it quickly. I'm issuing you a new card with expedited shipping. You should receive it in 2-3 business days.
Customer: What about my automatic payments? I have bills set up on this card.
Agent: Good question. I recommend updating those as soon as you receive your new card. In the meantime, I can note which merchants you have recurring payments with, and we'll ensure those go through while we transition you to the new card.
Customer: Okay, thank you. Is there anything else I should do?
Agent: I recommend monitoring your account closely for the next few weeks. We've also added extra security monitoring. If you see anything suspicious, call us immediately. Is there anything else I can help you with?
Customer: No, that's all. Thank you for your help."
4769-6671-5334-6233,Delivery Investigation,[Reason],"Agent: Hello, thank you for contacting TravelEase. This is Eric. How can I help you?
Customer: Hello, I'm calling about an order that shows delivered but I never received it.
Agent: I'm sorry to hear that. I'll definitely help you look into this. Can I get your order number?
Customer: It's 2286448. The tracking indicates delivery was completed, but there was nothing at my door.
Agent: Let me pull that up right away. Okay, I see the order for a bluetooth speaker. The tracking does show it was delivered by FedEx. Do you have cameras or neighbors who might have seen the delivery?
Customer: I've checked with my neighbors and looked at my security camera footage. Nothing shows a delivery. I've been home all day too.
Agent: That's definitely concerning. The carrier's note says it was left at the mailbox. Is that your usual delivery location?
Customer: Yes, but it's not there. I've checked everywhere. Could it have been delivered to the wrong address?
Agent: That's possible. Let me start an investigation with FedEx. I'm also going to file a claim on our end. In the meantime, would you like me to send a replacement?
Customer: Yes, please. I really need this bluetooth speaker. How long will the replacement take?
Agent: I can get a replacement shipped out today with expedited delivery at no extra charge. You should have it within 2-3 business days. I'm also adding a note to use signature confirmation.
Customer: Thank you. What about the investigation?
Agent: The carrier investigation usually takes 5-7 business days. If they locate the package or determine what happened, we'll contact you. You won't be charged twice - this is completely on us.
Customer: I appreciate that. This is the first time I've had this issue with your company.
Agent: Thank you for your patience and understanding. Your replacement order confirmation will be sent to your email shortly. Is there anything else I can help you with today?"
