id,outcome,cause,text
7900-7049-8075-7948,Delivery Investigation,[Reason],"Agent: Hello, thank you for contacting OnlineMarket. This is Daniel. How can I help you?
Customer: Hello, I'm calling about an order that shows delivered but I never received it.
Agent: I'm sorry to hear that. I'll definitely help you look into this. Can I get your order number?
Customer: It's 7801880. The tracking shows delivered at 2:15 PM, but there was nothing at my door.
Agent: Let me pull that up right away. Okay, I see the order for a exercise equipment. The tracking does show it was delivered by FedEx. Do you have cameras or neighbors who might have seen the delivery?
Customer: I've checked with my neighbors and looked at my security camera footage. Nothing shows a delivery. I've been home all day too.
Agent: That's definitely concerning. The carrier's note says it was left at the back entrance. Is that your usual delivery location?
Customer: Yes, but it's not there. I've checked everywhere. Could it have been delivered to the wrong address?
Agent: That's possible. Let me start an investigation with FedEx. I'm also going to file a claim on our end. In the meantime, would you like me to send a replacement?
Customer: Yes, please. I really need this exercise equipment. How long will the replacement take?
Agent: I can get a replacement shipped out today with expedited delivery at no extra charge. You should have it within 2-3 business days. I'm also adding a note to use signature confirmation.
Customer: Thank you. What about the investigation?
Agent: The carrier investigation usually takes 5-7 business days. If they locate the package or determine what happened, we'll contact you. You won't be charged twice - this is completely on us.
Customer: I appreciate that. This is the first time I've had this issue with your company.
Agent: Thank you for your patience and understanding. Your replacement order confirmation will be sent to your email shortly. Is there anything else I can help you with today?"
2958-6497-2966-8300,Account Access Issues,[Reason],"Agent: Good morning, this is Kevin with First National Bank online services. How can I assist you?
Customer: Hi, I can't log into my online banking. I reset my password last night, but when I try to use it, the system says it's invalid.
Agent: I'm sorry you're having trouble accessing your account. Let me pull up your information. Can you provide your account number?
Customer: It's 4287-9156-3302.
Agent: Thank you. For verification purposes, can you confirm your date of birth?
Customer: June 18th, 1982.
Agent: Perfect. I can see your account here. It looks like after several failed login attempts this morning, the account was automatically locked for security reasons.
Customer: But I was using the password from the reset email they sent me. Why wouldn't it work?
Agent: Let me check the timestamp on that password reset... I see the issue. The reset was initiated last night at 11:47 PM, but our system requires up to 24 hours for password changes to fully propagate across all platforms.
Customer: That's ridiculous. Why wasn't that mentioned in the email?
Agent: You're absolutely right - that should have been communicated clearly in the reset notification. I apologize for the confusion.
Customer: So what am I supposed to do? I need to transfer money today for a bill that's due.
Agent: I can help you with that right now. First, let me unlock your account and set you up with a temporary password that will work immediately.
Customer: Okay, that would be great.
Agent: Your account is now unlocked. Your temporary password is Capital-B-A-N-K-2-0-2-5. That's Capital B, capital A, capital N, capital K, then the numbers 2025.
Customer: Got it. Do I need to change this password right away?
Agent: When you log in with this temporary password, the system will prompt you to create a new permanent password.
Customer: Let me try logging in now while I have you on the phone... Okay, I'm in. It's asking me to create a new password.
Agent: Perfect. Make sure your new password is at least eight characters with a mix of letters, numbers, and symbols.
Customer: Alright, I've created a new one and it accepted it. So I should be all set now?
Agent: Yes, you're all set. This password will work immediately without any waiting period.
Customer: Great. Now about that transfer I need to make - can you walk me through it?
Agent: Absolutely. On your account dashboard, click on 'Transfers & Payments' in the main menu.
Customer: Okay, I see that.
Agent: Now select 'Transfer Between Accounts' or 'Pay Bills' depending on where the money needs to go.
Customer: It's to pay a credit card with another bank, so I'll select Pay Bills.
Agent: Perfect. Is this payee already set up in your system, or is this a new one?
Customer: It should already be there. Yes, I see it listed.
Agent: Great. Select that payee, enter the amount and the date you want the payment to process.
Customer: Done. It's asking me to confirm the details.
Agent: Review everything to make sure it's correct, then click Submit.
Customer: Okay, submitted. It says the payment is scheduled for tomorrow. Perfect timing.
Agent: Excellent. You'll receive a confirmation email as well. Is there anything else I can help you with?
Customer: No, that's everything. Thank you for your patience.
Agent: You're very welcome. We apologize again for the password reset confusion. Have a great day!"
7845-4737-7829-5607,Claim Denials,[Reason],"Agent: Thank you for calling CarePoint. This is Christine. How may I help you?
Customer: I received a denial letter for a medical claim and I'm really confused because I know this procedure is covered under my plan. It was for a lab work for my back.
Agent: I'm sorry to hear about the denial. I'll be happy to review this with you. Can I get your member ID number?
Customer: It's 90719447. The claim number is 185908.
Agent: Thank you. Let me pull up your claim... I see the claim for the lab work. According to the notes, it was denied due to lack of testing protocol.
Customer: But my doctor said everything was submitted correctly. They've done this many times before with your company.
Agent: I understand your frustration. Let me check the details... I'm looking at what was submitted. It appears the testing protocol documentation was submitted, but it was submitted three days after the procedure was performed.
Customer: So it was denied just because of timing? That seems really unfair. I was in pain and needed the lab work right away.
Agent: I completely understand. In cases where there's a medical emergency or urgent medical necessity, we can file an appeal. Did your doctor document that this was urgent or causing significant pain?
Customer: Yes, absolutely. I had been dealing with severe back pain for weeks, and it was affecting my ability to work.
Agent: That's important information. What I can do is initiate a testing protocol appeal for you right now. I'll need to get some documentation from your provider's office, but this type of appeal usually has a good chance of approval.
Customer: How long will that take?
Agent: The appeal process typically takes 30 business days, but I can request an expedited review which would be 72 hours. In the meantime, please don't pay the bill - wait for the appeal decision.
Customer: Okay, thank you. I was worried I'd be stuck with a huge bill.
Agent: You're welcome. I'm sending the appeal request now, and you'll receive a confirmation email. I'll also note that you were experiencing significant pain requiring urgent diagnostic testing. Is there anything else I can help clarify?"
9312-1164-3922-3757,Business Event - Major Policy Changes,[Reason],"Agent: SafeGuard Insurance Policy Services, this is Kevin. Are you calling about the recent policy notifications?
Customer: Yes. I got a letter saying my premium is increasing by $85 per month. I didn't agree to any changes.
Agent: I understand your concern. These changes are required by new state regulations that took effect on January 1st.
Customer: Required? By who? I don't want coverage I don't need.
Agent: The state legislature passed comprehensive insurance reform requiring all policies to include minimum coverage levels for mental health, preventive care, and prescription drugs.
Customer: But I'm healthy. I don't use any of those services. Why am I being forced to pay for them?
Agent: The regulations apply to all individual health insurance policies in the state. Every insurance company must comply.
Customer: So if I switch to another company, I'll still have the same increases?
Agent: Yes. All insurers are implementing similar changes because the regulations are mandatory across the industry.
Customer: $85 more per month is over $1000 a year. I can't afford that.
Agent: I completely understand. We do have some options that might help. We've created new high-deductible plans that meet the requirements but have lower premiums.
Customer: How much lower?
Agent: Our High Deductible Silver plan with the same mandated coverage is $62 less than your current plan after the increase.
Customer: What's the catch? Higher deductible means I pay more if I get sick, right?
Agent: Yes. Your deductible would increase from $2,500 to $6,000. However, this plan qualifies you for a Health Savings Account with tax benefits.
Customer: I don't understand HSAs. Explain that.
Agent: You can contribute pre-tax money to an HSA which grows tax-free and can be used for medical expenses. It's essentially a tax-advantaged medical savings account.
Customer: How much can I save in taxes?
Agent: Depending on your tax bracket, if you contribute the maximum $4,150 per year, you could save $600-800 in federal taxes.
Customer: So the higher deductible plan is actually cheaper overall?
Agent: It depends on your health needs and tax situation. If you're generally healthy and can afford the higher deductible, yes.
Customer: When do I have to decide?
Agent: You can change plans during our special enrollment period through December 31st. The new rates take effect January 1st regardless.
Customer: Can you email me detailed information about both options so I can compare?
Agent: Absolutely. I'm sending a comprehensive comparison including premium costs, deductibles, copays, and HSA benefits right now.
Customer: And these changes are definitely not your company's choice? This is the state forcing it?
Agent: Correct. You can review the actual legislation - it's Senate Bill 847. I can include a link to the full text in my email.
Customer: Yes, please do that. I want to see this for myself."
2353-3890-7093-5494,Business Event - Ransomware Attack,[Reason],"Agent: City Hospital Crisis Line, this is Rachel. We're experiencing a cybersecurity incident.
Customer: I just got a text saying my surgery scheduled for tomorrow is cancelled. Why? I've been waiting three months for this.
Agent: I'm very sorry. The hospital was hit by a ransomware attack last night. Our electronic health record systems are completely offline.
Customer: Ransomware? Does that mean hackers have my medical records?
Agent: We're investigating the extent of data access. Right now, we know our systems are encrypted and we cannot access patient records electronically.
Customer: But you still have my records, right? You can still do my surgery?
Agent: We have paper backups, but without computer access, we cannot safely perform elective surgeries. We're only handling emergency cases.
Customer: Elective? This is knee replacement surgery. I can barely walk!
Agent: I understand, and I'm very sorry. 'Elective' means it's scheduled in advance, not that it's optional. We've had to reschedule all non-emergency procedures.
Customer: For how long? When can I have my surgery?
Agent: We're hoping to restore systems within one week. You'll be our first priority for rescheduling once we're operational.
Customer: One week? I've taken time off work, arranged care for my kids. This is a disaster.
Agent: I completely understand your frustration. The hospital is covering any costs you've incurred for your preparations.
Customer: Costs? What about my vacation days? My lost wages?
Agent: Our patient advocate team is documenting all impacts. The hospital will work with affected patients on appropriate compensation.
Customer: Did the hackers access my social security number? My insurance information?
Agent: We don't know yet. We're offering free credit monitoring and identity theft protection to all patients as a precaution.
Customer: As a precaution? That means you think they got the data.
Agent: We're taking every security measure seriously. Cybersecurity experts and the FBI are investigating. You'll receive detailed notification letters.
Customer: The FBI? This is that serious?
Agent: Yes. Ransomware attacks on hospitals are federal crimes. Law enforcement is fully involved.
Customer: Can I go to a different hospital for my surgery?
Agent: Yes, absolutely. We can facilitate transfer of your care. I can help coordinate that if you'd like.
Customer: I've been seeing Dr. Peters for years. I trust him. I don't want a different surgeon.
Agent: Dr. Peters has privileges at County Medical Center. He could potentially perform your surgery there. Would you like me to contact his office?
Customer: Yes, please. I need this surgery soon.
Agent: I'm connecting with Dr. Peters' office now to arrange that. You'll receive a call within two hours about scheduling."
6896-9763-3877-2596,Business Event - Product Recall,[Reason],"Agent: Thank you for calling CloudTech Product Safety Line. This is Emma. How can I help you?
Customer: Hi, I just heard about a recall on the Model X-500 blender. I purchased one a few months ago and I'm concerned.
Agent: Thank you for calling. Yes, we did issue a voluntary recall on that model due to motor overheating that poses a potential burn hazard. I can help you with the recall process right away.
Customer: Is it safe to use at all? I used it just yesterday.
Agent: We recommend you stop using the product immediately and unplug it. The defect doesn't affect all units, but out of an abundance of caution, we're recalling all units from this production batch.
Customer: Okay, I'll unplug it right now. What do I need to do for the recall?
Agent: I'll need your product's serial number and proof of purchase. The serial number should be on the bottom of the unit. Do you have it handy?
Customer: Let me check... Yes, it's PR132810.
Agent: Thank you. That serial number is confirmed as part of the recalled batch. We're offering affected customers a full refund or replacement. Which would you prefer?
Customer: I'd like a replacement with a newer model if possible.
Agent: Absolutely. We'll send you our newest model at no charge, and we'll send you a prepaid shipping label to return the recalled unit. The new unit will arrive within 5-7 business days.
Customer: Thank you. Should I be worried about any safety issues from having used it?
Agent: The burn hazard is primarily a concern with extended use or specific usage patterns. If you haven't experienced any issues so far, you should be fine. However, if you have any concerns, please consult with a medical professional. We take product safety very seriously and apologize for this inconvenience.
Customer: I appreciate your help and the quick response on this."
5767-1324-5529-7613,Service Interruptions,[Reason],"Agent: Thank you for calling DataLink technical support. This is Thomas. What can I help you with today?
Customer: My cable TV has been out for since yesterday and I really need it working. I work from home and this is affecting my job.
Agent: I'm very sorry to hear your cable TV is down. I understand how important this is. Let me pull up your account and run some diagnostics.
Customer: I've already tried restarting my cable box multiple times. Nothing works.
Agent: I appreciate you trying that. Let me check our system... I can see your account and I'm running a remote diagnostic on your cable box now. Can you tell me what lights are showing on your cable box?
Customer: The power light is on, but the channels light is blinking red.
Agent: Okay, that helps. The blinking red light indicates a signal strength issue. Let me check the broadcast system in your area... Ah, I see there's a reported outage affecting your neighborhood. A fiber line was damaged during construction work.
Customer: So there's nothing wrong with my cable box? How long until it's fixed?
Agent: Correct, your cable box is fine. Our technicians are on site now repairing the damage. The estimated restoration time is 4 PM today.
Customer: That's still several hours away. Is there anything else I can do? I have an important meeting.
Agent: I understand the urgency. What I can do is provide you with a temporary alternate connection method at no charge. Would that help?
Customer: Yes, that would be very helpful. Thank you.
Agent: Great. I'm setting that up for you now. You'll receive instructions via text message within the next 10 minutes. I'm also crediting your account for the since yesterday of outage. Is there anything else I can help with?
Customer: No, that's all. I appreciate your help."
6578-9657-8370-1678,Delivery Investigation,[Reason],"Agent: Hello, thank you for contacting TravelEase. This is Stephanie. How can I help you?
Customer: Hello, I'm calling about an order that shows delivered but I never received it.
Agent: I'm sorry to hear that. I'll definitely help you look into this. Can I get your order number?
Customer: It's 3189227. The tracking shows it arrived three days ago, but there was nothing at my door.
Agent: Let me pull that up right away. Okay, I see the order for a desk organizer. The tracking does show it was delivered by USPS. Do you have cameras or neighbors who might have seen the delivery?
Customer: I've checked with my neighbors and looked at my security camera footage. Nothing shows a delivery. I've been home all day too.
Agent: That's definitely concerning. The carrier's note says it was left at the reception desk. Is that your usual delivery location?
Customer: Yes, but it's not there. I've checked everywhere. Could it have been delivered to the wrong address?
Agent: That's possible. Let me start an investigation with USPS. I'm also going to file a claim on our end. In the meantime, would you like me to send a replacement?
Customer: Yes, please. I really need this desk organizer. How long will the replacement take?
Agent: I can get a replacement shipped out today with expedited delivery at no extra charge. You should have it within 2-3 business days. I'm also adding a note to use signature confirmation.
Customer: Thank you. What about the investigation?
Agent: The carrier investigation usually takes 5-7 business days. If they locate the package or determine what happened, we'll contact you. You won't be charged twice - this is completely on us.
Customer: I appreciate that. This is the first time I've had this issue with your company.
Agent: Thank you for your patience and understanding. Your replacement order confirmation will be sent to your email shortly. Is there anything else I can help you with today?"
2236-2468-2039-9550,Update Failures,[Reason],"Agent: Thank you for calling DigitalSupport technical support. This is Steven. How can I assist you?
Customer: Hi, I updated my accounting program yesterday and now it crashes every single time I try to launch it.
Agent: I'm sorry to hear you're experiencing issues after the update. That's definitely frustrating. Can you tell me which version you updated to?
Customer: I think it was version 10.9. The update installed automatically.
Agent: I see. There have been some reported compatibility issues with that version on certain system configurations. Let me check your system setup. Are you on Windows or Mac?
Customer: macOS Ventura. I have a fairly new computer, so I don't think that's the issue.
Agent: Let me look into this... The issue seems to be related to the calculation module in the new version conflicting with your database connection. This is affecting a small percentage of users.
Customer: Okay, so how do I fix it? I need this software for work and I have deadlines.
Agent: I completely understand the urgency. I can guide you through rolling back to the backup file, which was stable. Alternatively, there's a hotfix patch that was just released this morning that should resolve the issue. Which would you prefer?
Customer: If there's a fix available, I'd rather try that first instead of downgrading.
Agent: Absolutely. I'm sending you a link to download the hotfix patch right now. It's a small file, about 193MB. Once you download it, run the installer and it will patch the calculation module issue.
Customer: Okay, I'm downloading it now. Should I uninstall the current version first?
Agent: No, don't uninstall. The patch will install over the existing version. Just make sure the accounting program is closed when you run the patch installer.
Customer: Got it. The download is complete. I'm running it now.
Agent: Perfect. The installation should take about 2-3 minutes. Once it's done, try launching the accounting program again. I'll stay on the line with you.
Customer: Okay, the patch is installed... Let me try opening the software... It's working! Thank you so much!
Agent: Excellent! I'm glad we got that resolved. If you experience any other issues, don't hesitate to call back. Is there anything else I can help with today?"
3395-8400-8052-5184,Escalation - Repeated Service Failures,[Reason],"Agent: Thank you for calling GlobalBank. This is Charles. How can I help you?
Customer: I've been trying to resolve an issue for over two weeks now and nobody seems to be able to help me. My direct deposits keep failing.
Agent: I apologize for the difficulties you've experienced. Let me pull up your account and see what's happening.
Customer: I've already explained this to multiple different people. Each time I'm told it's fixed, but it's not.
Agent: I understand your frustration. Can you provide your account number so I can review the history?
Customer: It's 5515-8220-7400. But honestly, I don't think you can help me. I need to speak with a supervisor.
Agent: I completely understand. Before I transfer you, let me quickly review your account to brief them on the situation. That way you won't have to explain everything again.
Customer: Fine, but make it quick. I've wasted enough time on this.
Agent: I'm looking at your employer details now. I can see you've attempted several direct deposits in the past over two weeks, and all have failed with error code 5502.
Customer: Yes! And nobody can tell me what that error means or how to fix it.
Agent: Error 5502 typically indicates a routing setup failure. Have you recently made any changes to your deposit schedule?
Customer: No, nothing has changed. I've been using this same deposit schedule without problems for a long time.
Agent: That's very strange. Let me check something... I'm seeing that our system flagged your deposit schedule for verification after a payroll integration last month. That's why the direct deposits are failing.
Customer: Why wasn't I notified about this? And why didn't the other agents see this?
Agent: I sincerely apologize. This should have been communicated to you. I can verify your deposit schedule right now, which will resolve the issue.
Customer: I still want to speak with a supervisor. This has been incredibly frustrating and I want to file a formal complaint.
Agent: Absolutely, you have every right to speak with a supervisor. Let me get your deposit schedule verified first so we can prevent any further issues, and then I'll transfer you directly to my supervisor."
