id,outcome,cause,text
8407-7062-1919-8465,Claim Denials,[Reason],"Agent: Thank you for calling SafeGuard Insurance claims department. My name is Nicole. How can I help you today?
Customer: I received a denial letter for a medical claim and I'm really confused because I know this procedure is covered under my policy.
Agent: I'd be happy to review that with you. Can you provide your member ID number?
Customer: It's SG-8829473.
Agent: Thank you. And which claim are you calling about?
Customer: It was for an MRI scan I had done three weeks ago. The claim number is 2025-449382.
Agent: Let me pull that up... Okay, I can see the claim. It shows a denial with the reason listed as 'procedure not medically necessary.' Can you tell me why your doctor ordered this MRI?
Customer: I've had chronic back pain for months. My doctor tried physical therapy first, then prescribed anti-inflammatories, but nothing helped. The MRI was to see if I need surgery.
Agent: That certainly sounds like appropriate progressive treatment. Let me look more closely at the claim details and the documentation submitted.
Customer: My doctor's office said they submitted all the necessary paperwork.
Agent: I'm reviewing the submission now... I think I've found the issue. The procedure code submitted was 72141, which is a cervical spine MRI, but the physician notes indicate lumbar spine.
Customer: So they billed for the wrong body part?
Agent: It appears to be a coding error. For lumbar spine, the correct code should be 72148. That code is covered under your policy with prior authorization.
Customer: Well, we did get prior authorization. I have the approval letter right here.
Agent: Let me check that... Yes, I can see the prior authorization in our system. It's specifically for lumbar MRI code 72148.
Customer: So this is just a billing mistake from the hospital?
Agent: Yes, and you shouldn't have to worry about fixing it. I can request a corrected claim directly from the provider's billing department.
Customer: How long will that take? I have a bill for over $2,000 that I can't afford to pay.
Agent: I completely understand your concern. I'm flagging this as urgent for reprocessing. Once the provider submits the corrected code, I can typically have this reviewed and approved within five business days.
Customer: But what do I tell the hospital in the meantime? They're already sending bills.
Agent: I'm going to do two things. First, I'll contact the hospital's billing office today to request the corrected claim. Second, I'll email you a letter confirming that this claim is being actively reprocessed.
Customer: Can I send that letter to the hospital?
Agent: Absolutely. That letter should stop any collection activity while the claim is being corrected. You'll have it within the next hour.
Customer: Okay, that helps. What will I owe once the claim is processed correctly?
Agent: Looking at your policy details and the procedure code, you'll only be responsible for your specialist copay of $40.
Customer: Just $40? So insurance will cover the rest of the $2,000?
Agent: Exactly. Once the corrected claim processes, we'll pay our portion directly to the hospital and they'll adjust your bill to just the copay amount.
Customer: Oh thank goodness. I've been so stressed about this.
Agent: I can imagine. Medical billing can be complicated, but we're here to help. Is there anything else I can clarify about your coverage?
Customer: No, you've explained everything very clearly. Thank you so much.
Agent: You're very welcome. You should receive that confirmation email shortly, and I'll personally follow up on this claim to make sure it's resolved.
Customer: I really appreciate that.
Agent: My pleasure. Take care!"
9586-8150-1617-6548,Business Event - Product Recall,[Reason],"Agent: Thank you for calling SoftwarePro Product Safety Line. This is Laura. How can I help you?
Customer: Hi, I just heard about a recall on the Pro-Line food processor. I purchased one a few months ago and I'm concerned.
Agent: Thank you for calling. Yes, we did issue a voluntary recall on that model due to blade detachment issue that poses a potential injury risk. I can help you with the recall process right away.
Customer: Is it safe to use at all? I used it just yesterday.
Agent: We recommend you stop using the product immediately and unplug it. The defect doesn't affect all units, but out of an abundance of caution, we're recalling all units from this production batch.
Customer: Okay, I'll unplug it right now. What do I need to do for the recall?
Agent: I'll need your product's serial number and proof of purchase. The serial number should be on the bottom of the unit. Do you have it handy?
Customer: Let me check... Yes, it's SN667130.
Agent: Thank you. That serial number is confirmed as part of the recalled batch. We're offering affected customers a refund and upgrade. Which would you prefer?
Customer: I'd like a replacement with a newer model if possible.
Agent: Absolutely. We'll send you our newest model at no charge, and we'll send you a prepaid shipping label to return the recalled unit. The new unit will arrive within 5-7 business days.
Customer: Thank you. Should I be worried about any safety issues from having used it?
Agent: The injury risk is primarily a concern with extended use or specific usage patterns. If you haven't experienced any issues so far, you should be fine. However, if you have any concerns, please consult with a medical professional. We take product safety very seriously and apologize for this inconvenience.
Customer: I appreciate your help and the quick response on this."
7063-9834-2363-1164,Fraud Alert Investigation,[Reason],"Agent: Thank you for calling SecureBank Fraud Prevention, this is Victoria. How can I help you today?
Customer: Hi, I just checked my credit card statement and there are charges I don't recognize. I think someone might be using my card.
Agent: I'm sorry to hear that. Let's get this investigated right away. Can you provide the last four digits of the card in question?
Customer: Yes, it ends in 8364.
Agent: Thank you. I have your account pulled up now. Can you tell me which specific transactions look suspicious to you?
Customer: There are four charges from yesterday. Two are from gas stations in Texas for $85 each, and two more from an online electronics retailer totaling about $650.
Agent: And you didn't make any of these purchases?
Customer: No, definitely not. I live in Washington and I haven't been to Texas in years. Plus, I didn't order anything online recently.
Agent: I can see these transactions in our system. Given that the locations don't match your usual spending pattern, I'm going to block this card immediately to prevent any additional unauthorized charges.
Customer: Okay, good. What happens to the money that was already taken?
Agent: We'll initiate a chargeback for all four fraudulent transactions. The credits should post to your account within two to three business days.
Customer: That's a relief. But I'm concerned about how someone got my card information in the first place.
Agent: That's a valid concern. Card information can be compromised in several ways. Have you recently used your card at any ATMs, especially standalone ones at gas stations?
Customer: Actually, I did use an ATM at a convenience store about a week ago. Could that be it?
Agent: Unfortunately, yes. Standalone ATMs are sometimes targeted by criminals who install skimming devices to capture card data.
Customer: That's scary. So what do I do now? Will I be without a card?
Agent: I'm issuing you a new card right now with a completely different number. For shipping, we have standard delivery which takes seven to ten business days, or I can expedite it for you.
Customer: How much does expedited shipping cost?
Agent: Given the circumstances of fraud, I'm waiving the expedite fee. You'd receive your new card in two to three business days.
Customer: Yes, please do that. I have bills I need to pay soon.
Agent: Done. I've also placed a fraud alert on your credit file with the three major bureaus as an additional security measure.
Customer: Thank you. Do I need to do anything else on my end?
Agent: I'd recommend monitoring your other financial accounts closely for the next few weeks. Also, once you receive your new card, you'll need to update any automatic payments or recurring subscriptions.
Customer: Oh right, I have several subscriptions. Is there a way to see what's set up for auto-pay?
Agent: Yes, I can email you a list of all merchants with recurring charges on this card. That should make updating them easier.
Customer: That would be very helpful.
Agent: I'm sending that to your email address on file right now. You should receive it within the next few minutes.
Customer: Perfect. Thank you for handling this so quickly.
Agent: You're welcome. We take fraud very seriously. Is there anything else I can help you with today?
Customer: No, I think that covers everything.
Agent: Alright. Your new card will arrive by Friday. Have a great day and stay vigilant with your accounts.
Customer: I will. Thanks again."
4482-5282-1733-3649,Escalation - Unauthorized Account Closure,[Reason],"Agent: Bank Resolution Center, this is Ryan speaking. How can I help?
Customer: My account was closed without any warning and now my rent check bounced. I need to speak with someone in charge immediately.
Agent: I'm very sorry to hear that. Let me pull up your account right away. Can you provide your account number?
Customer: The account number is 7729-4483-2910. But I shouldn't have to explain this again. This is the third person I've talked to.
Agent: I apologize for the run-around. I'm looking at your account now... I can see it was flagged as inactive and automatically closed.
Customer: Inactive? I use that account every week! I have direct deposit and automatic payments set up. How is that inactive?
Agent: You're absolutely right. This was clearly an error in our system. Your account shows regular activity.
Customer: An error? Do you realize I now have a bounced check on my record? My landlord is threatening eviction!
Agent: I understand the severity of this situation. Let me escalate this to our account recovery team immediately.
Customer: No, I don't want another team. I want to speak with a vice president or someone who can actually fix this.
Agent: Let me connect you with our branch manager who has authority to resolve this completely. But first, let me document what we'll do.
Customer: Fine, but this better be good.
Agent: We're going to reopen your account immediately, restore all your funds, cover the bounced check fee, and provide a letter to your landlord explaining our error.
Customer: What about the damage to my rental history? A bounced rent check is serious.
Agent: The manager will personally call your landlord to explain this was entirely the bank's fault. We'll also compensate you $200 for the inconvenience.
Customer: And my credit report? Will this bounced check show up there?
Agent: No, because we're covering it as our error. There will be no negative credit reporting. We're also placing a note in our system to prevent this from happening again.
Customer: This has been incredibly stressful. I've been banking with you for 10 years and this is how I'm treated?
Agent: You're absolutely right to be upset. Let me transfer you to Sarah Martinez, our branch manager. She'll personally oversee the resolution.
Customer: She better call my landlord today. The eviction notice is dated tomorrow.
Agent: I'm noting that urgency in your file right now. Sarah will handle this as her top priority. Please hold for the transfer."
1568-5457-1058-9098,Delivery Investigation,[Reason],"Agent: Thank you for calling ShopExpress customer care. This is Catherine. How may I help you today?
Customer: Hello, I'm calling about an order that shows delivered but I never received it.
Agent: I understand how concerning that must be. Let me look into this for you. Can you provide your order number?
Customer: Yes, it's SE-7293841.
Agent: Thank you. Give me just a moment to pull up the details... Okay, I can see this order was marked as delivered yesterday at 4:22 PM.
Customer: Right, but there's nothing on my porch or at my door. I've checked everywhere.
Agent: That's very strange. Let me see if the delivery driver left any notes or took a photo. We usually require photo confirmation for deliveries.
Customer: Okay, please check.
Agent: I'm viewing the delivery photo now. This is interesting - the photo shows the package next to a blue door with the house number 847.
Customer: My door isn't blue. I have a white door.
Agent: What's your house number?
Customer: I'm at 874 Maple Street.
Agent: Ah, there's the problem. The photo clearly shows 847, not 874. It appears the driver transposed the numbers and delivered to the wrong address.
Customer: So my package is sitting at someone else's house?
Agent: Unfortunately, yes. Have you had a chance to check with your neighbors at 847?
Customer: No, I haven't. Should I go knock on their door?
Agent: You could certainly try that. However, regardless of whether you can retrieve it from them, I want to make sure you get your items. What was in this order?
Customer: It was a birthday gift for my daughter - a toy set and some books. Her party is this Saturday.
Agent: I completely understand the urgency. Here's what I'm going to do. I'm going to ship you a replacement order immediately with expedited delivery at no additional charge.
Customer: Really? When would I get it?
Agent: With expedited shipping, it should arrive by Thursday, which gives you two days before the party.
Customer: That would be perfect. But what if my neighbor returns the original package?
Agent: If that happens, you can keep both orders as our apology for this delivery error. Or if you prefer, we can arrange for one to be picked up.
Customer: Wow, that's generous. Thank you so much.
Agent: It's the least we can do. I'm also adding a note to your address profile to prevent this from happening again.
Customer: What kind of note?
Agent: I'm flagging your address with special instructions for drivers to verify the house number carefully. It'll include a description of your white door as an additional identifier.
Customer: That's a great idea.
Agent: I've also credited your account with $25 as an apology for the inconvenience. You can use that toward a future purchase.
Customer: Thank you. You've been incredibly helpful.
Agent: I'm glad I could resolve this for you. You'll receive a confirmation email with the new tracking number within the next hour.
Customer: Perfect. I really appreciate your help.
Agent: You're very welcome. Is there anything else I can assist you with today?
Customer: No, that's everything. Thank you again.
Agent: My pleasure. Have a wonderful day and enjoy your daughter's party!"
6203-9073-4048-2952,Service Interruptions,[Reason],"Agent: Thank you for calling SecureBank technical support. This is Tyler. What can I help you with today?
Customer: My internet has been out for three days and I really need it working. I work from home and this is affecting my job.
Agent: I'm very sorry to hear your internet is down. I understand how important this is. Let me pull up your account and run some diagnostics.
Customer: I've already tried restarting my modem multiple times. Nothing works.
Agent: I appreciate you trying that. Let me check our system... I can see your account and I'm running a remote diagnostic on your modem now. Can you tell me what lights are showing on your modem?
Customer: The power light is on, but the connection light is blinking red.
Agent: Okay, that helps. The blinking red light indicates a signal levels issue. Let me check the service node in your area... Ah, I see there's a reported outage affecting your neighborhood. A fiber line was damaged during construction work.
Customer: So there's nothing wrong with my modem? How long until it's fixed?
Agent: Correct, your modem is fine. Our technicians are on site now repairing the damage. The estimated restoration time is by end of business today.
Customer: That's still several hours away. Is there anything else I can do? I have an important meeting.
Agent: I understand the urgency. What I can do is provide you with a temporary data credit at no charge. Would that help?
Customer: Yes, that would be very helpful. Thank you.
Agent: Great. I'm setting that up for you now. You'll receive instructions via text message within the next 10 minutes. I'm also crediting your account for the three days of outage. Is there anything else I can help with?
Customer: No, that's all. I appreciate your help."
9737-8869-6579-6777,Delivery Investigation,[Reason],"Agent: Hello, thank you for contacting BuyNow. This is Nicole. How can I help you?
Customer: Hello, I'm calling about an order that shows delivered but I never received it.
Agent: I'm sorry to hear that. I'll definitely help you look into this. Can I get your order number?
Customer: It's 9038010. The tracking indicates delivery was completed, but there was nothing at my door.
Agent: Let me pull that up right away. Okay, I see the order for a exercise equipment. The tracking does show it was delivered by OnTrac. Do you have cameras or neighbors who might have seen the delivery?
Customer: I've checked with my neighbors and looked at my security camera footage. Nothing shows a delivery. I've been home all day too.
Agent: That's definitely concerning. The carrier's note says it was left at the back entrance. Is that your usual delivery location?
Customer: Yes, but it's not there. I've checked everywhere. Could it have been delivered to the wrong address?
Agent: That's possible. Let me start an investigation with OnTrac. I'm also going to file a claim on our end. In the meantime, would you like me to send a replacement?
Customer: Yes, please. I really need this exercise equipment. How long will the replacement take?
Agent: I can get a replacement shipped out today with expedited delivery at no extra charge. You should have it within 2-3 business days. I'm also adding a note to use signature confirmation.
Customer: Thank you. What about the investigation?
Agent: The carrier investigation usually takes 5-7 business days. If they locate the package or determine what happened, we'll contact you. You won't be charged twice - this is completely on us.
Customer: I appreciate that. This is the first time I've had this issue with your company.
Agent: Thank you for your patience and understanding. Your replacement order confirmation will be sent to your email shortly. Is there anything else I can help you with today?"
7985-4046-4788-7982,Multiple Issues - Order Status & Account Access,[Reason],"Agent: Thank you for calling QuickShop customer care. This is Daniel. How may I assist you?
Customer: Hi, I'm calling about order QS-448921. It was supposed to arrive yesterday but the tracking hasn't updated in four days.
Agent: I'm sorry to hear about the delay. Let me check on that for you. Can you provide your email address?
Customer: It's patricia.garcia22@email.com.
Agent: Thank you. I'm looking at your order... It appears the package is stuck at a distribution center due to weather delays in the Midwest.
Customer: When will it actually get here? I need this for an event on Friday.
Agent: According to the carrier, it should be delivered by Thursday. I can also see if we can expedite a replacement if you're concerned it won't make it in time.
Customer: Let's wait and see if it arrives Thursday. Actually, while I'm on the phone, I need to return something from a different order.
Agent: Of course, I can help with that. Which order are we talking about?
Customer: Order QS-445102. I received a sweater but it's the wrong size. I ordered a medium but got a large.
Agent: I apologize for the error. Let me create a return label for you. Would you like to exchange it for the correct size or get a refund?
Customer: I'd like to exchange it for a medium, but I need it quickly. When would the replacement arrive?
Agent: I can ship the replacement today with expedited delivery. You'd receive it in 2-3 business days. The return label for the large will be emailed to you.
Customer: Perfect. Oh, and I'm also having trouble logging into my account. I forgot my password and the reset email isn't coming through.
Agent: I can help with that. For security, can you verify your phone number on file?
Customer: It should be 555-7834.
Agent: That matches our records. Let me check your email settings... I see the issue. Your email address was marked as inactive due to bounced messages. Can you confirm the email is still active?
Customer: Yes, I'm using it regularly. Maybe it went to spam?
Agent: Possible. I'm re-sending the password reset email now. It should arrive within a few minutes. Check your spam folder if you don't see it.
Customer: Okay, let me check... Yes! I just got it. Let me reset my password real quick.
Agent: Take your time.
Customer: Done. I'm logged in now. So to summarize - my delayed order should arrive Thursday, you're sending a replacement sweater in the correct size, and I'm back into my account?
Agent: Exactly right. You'll receive two emails shortly - one with the return label and another confirming the replacement sweater shipment.
Customer: Wonderful. Thank you for helping with all of that.
Agent: My pleasure. Is there anything else you need today?
Customer: No, that's everything. Thanks again!
Agent: You're welcome. Have a great day!"
5105-4557-5587-5506,Escalation - Repeated Service Failures,[Reason],"Agent: Thank you for calling HealthFirst. This is Olivia. How can I help you?
Customer: I've been trying to resolve an issue for three weeks now and I keep getting transferred around. My card activations keep failing.
Agent: I understand your frustration with this. Let me pull up your account and see what's happening.
Customer: I've already explained this to three different people. Each time I'm told it's fixed, but it's not.
Agent: I understand your frustration. Can you provide your account number so I can review the history?
Customer: It's 7655-2878-5570. But honestly, I don't think you can help me. I need to speak with a supervisor.
Agent: I completely understand. Before I transfer you, let me quickly review your account to brief them on the situation. That way you won't have to explain everything again.
Customer: Fine, but make it quick. I've wasted enough time on this.
Agent: I'm looking at your PIN setup now. I can see you've attempted several card activations in the past three weeks, and all have failed with error code 2205.
Customer: Yes! And nobody can tell me what that error means or how to fix it.
Agent: Error 2205 typically indicates a card reader failure. Have you recently made any changes to your activation system?
Customer: No, nothing has changed. I've been using this same activation system without problems for a long time.
Agent: That's very strange. Let me check something... I'm seeing that our system flagged your activation system for verification after a verification code last month. That's why the card activations are failing.
Customer: Why wasn't I notified about this? And why didn't the other agents see this?
Agent: I sincerely apologize. This should have been communicated to you. I can verify your activation system right now, which will resolve the issue.
Customer: I still want to speak with a supervisor. This has been incredibly frustrating and I want to file a formal complaint.
Agent: Absolutely, you have every right to speak with a supervisor. Let me get your activation system verified first so we can prevent any further issues, and then I'll transfer you directly to my supervisor."
4185-2671-7368-9635,"Multiple Issues - Claim, Coverage & Policy",[Reason],"Agent: SoftwarePro. This is Andrew speaking. How can I help?
Customer: I submitted a claim two weeks ago and haven't heard anything. Also, I want to know if my plan covers vision exam, and I need to add my spouse to my policy.
Agent: I'll help with all of that. Can I get your policy number?
Customer: It's 71785691.
Agent: Thank you. Let me check your claim status... I see the claim for $640. It's currently in review and should be processed within the next 5 business days.
Customer: Why is it taking so long?
Agent: It required additional documentation from your provider, which we just received yesterday. That's why there was a delay. It's being processed now.
Customer: Okay. Does my plan cover vision exam?
Agent: Let me check your coverage... Yes, vision exam is covered under preventive care with no copay.
Customer: Great. And how do I add my spouse?
Agent: I can start that process now. I'll need their information and there will be a policy update form. The additional premium would be $142/month. Should I email you the forms?
Customer: Yes, please send them to richard.smith@email.com.
Agent: Sent. Complete and return within 30 days for coverage to start next month."
