id,outcome,cause,text
6455-6008-8560-4945,"Multiple Issues - Appointment, Prescription & Insurance",[Reason],"Agent: NetworkPro. This is Jessica. How may I help you?
Customer: Hi, I need to reschedule my appointment with Dr. Anderson, get a prescription refill, and verify my insurance coverage for a procedure.
Agent: I can help with all three. Let me pull up your file. What's your date of birth?
Customer: 12/23/1961.
Agent: Thank you. I see your appointment with Dr. Anderson is next Tuesday at 2 PM. When would you like to reschedule?
Customer: Anytime next week except Tuesday or Wednesday.
Agent: I have Thursday at 10 AM or Friday at 3 PM available.
Customer: Thursday works. Now, I need a refill on my thyroid medication.
Agent: I can send that refill request to your pharmacy. Which pharmacy do you use?
Customer: Walgreens on Main Street.
Agent: Sent. It'll be ready in 24 hours. Lastly, what procedure do you need insurance verification for?
Customer: I need to know if my insurance covers physical therapy sessions.
Agent: Let me check... Yes, your plan covers physical therapy with a $38 copay per visit, up to 30 visits per year. You'll need a referral from your primary care doctor.
Customer: Perfect. That's everything I needed. Thank you!"
6326-5768-1576-3519,Delivery Investigation,[Reason],"Agent: Hello, thank you for contacting HotelPrime. This is Mark. How can I help you?
Customer: Hello, I'm calling about an order that shows delivered but I never received it.
Agent: I'm sorry to hear that. I'll definitely help you look into this. Can I get your order number?
Customer: It's 6119315. The tracking was marked delivered yesterday afternoon, but there was nothing at my door.
Agent: Let me pull that up right away. Okay, I see the order for a smart watch. The tracking does show it was delivered by USPS. Do you have cameras or neighbors who might have seen the delivery?
Customer: I've checked with my neighbors and looked at my security camera footage. Nothing shows a delivery. I've been home all day too.
Agent: That's definitely concerning. The carrier's note says it was left at the reception desk. Is that your usual delivery location?
Customer: Yes, but it's not there. I've checked everywhere. Could it have been delivered to the wrong address?
Agent: That's possible. Let me start an investigation with USPS. I'm also going to file a claim on our end. In the meantime, would you like me to send a replacement?
Customer: Yes, please. I really need this smart watch. How long will the replacement take?
Agent: I can get a replacement shipped out today with expedited delivery at no extra charge. You should have it within 2-3 business days. I'm also adding a note to use signature confirmation.
Customer: Thank you. What about the investigation?
Agent: The carrier investigation usually takes 5-7 business days. If they locate the package or determine what happened, we'll contact you. You won't be charged twice - this is completely on us.
Customer: I appreciate that. This is the first time I've had this issue with your company.
Agent: Thank you for your patience and understanding. Your replacement order confirmation will be sent to your email shortly. Is there anything else I can help you with today?"
1925-7188-4622-6588,Business Event - Warehouse Fire,[Reason],"Agent: ShopNow Emergency Line, this is Victoria. I apologize, we're experiencing a major disruption.
Customer: I'm calling about my order SN-8847291. The tracking hasn't updated in three days and it was supposed to arrive today.
Agent: I'm very sorry, but we had a fire at our main distribution center on Monday. Your order was in that facility.
Customer: A fire? Was anyone hurt? And what happened to my order?
Agent: Thankfully, all our employees evacuated safely and there were no injuries. However, approximately 40% of inventory was damaged.
Customer: Is my order part of that 40%? I ordered my daughter's birthday presents and her party is this weekend.
Agent: Let me check your specific order... Unfortunately, yes. Your order was in the affected section and was destroyed.
Customer: Oh no. What am I supposed to do now? I can't get these items anywhere else in time.
Agent: I completely understand the urgency. Here's what we can do - we're expediting replacement orders from our backup warehouse.
Customer: When would that arrive? The party is Saturday.
Agent: I can have it shipped via overnight air at no charge. You'd receive it Friday.
Customer: That's cutting it very close. What if something goes wrong again?
Agent: I understand your concern. As an alternative, I can check if any of our retail stores have these items in stock for immediate pickup.
Customer: That would be better. Can you check?
Agent: Checking now... Yes, our downtown location has both items. I can reserve them for you to pick up today.
Customer: Perfect. And what about my original payment?
Agent: Your original order has been fully refunded. The store pickup will be at no charge as our apology for this situation.
Customer: You're giving me the items for free?
Agent: Yes. Given the fire and the stress this has caused, we're providing your replacement order at no cost. We're also giving you a $50 credit for future purchases.
Customer: Wow, I wasn't expecting that. Thank you. I'm sorry about the fire - that must be devastating for your company.
Agent: We appreciate your understanding. The important thing is everyone is safe and we can still serve our customers. Your items will be ready for pickup in one hour."
9147-8804-9534-2418,Escalation - Repeated Service Failures,[Reason],"Agent: Thank you for calling WellnessCenter. This is Scott. How can I help you?
Customer: I've been trying to resolve an issue for several weeks now and everyone gives me a different answer. My wire transfers keep failing.
Agent: I'm really sorry you've been dealing with this. Let me pull up your account and see what's happening.
Customer: I've already explained this to multiple different people. Each time I'm told it's fixed, but it's not.
Agent: I understand your frustration. Can you provide your account number so I can review the history?
Customer: It's 1747-8415-4895. But honestly, I don't think you can help me. I need to speak with a supervisor.
Agent: I completely understand. Before I transfer you, let me quickly review your account to brief them on the situation. That way you won't have to explain everything again.
Customer: Fine, but make it quick. I've wasted enough time on this.
Agent: I'm looking at your beneficiary details now. I can see you've attempted several wire transfers in the past several weeks, and all have failed with error code 2205.
Customer: Yes! And nobody can tell me what that error means or how to fix it.
Agent: Error 2205 typically indicates a transfer limits failure. Have you recently made any changes to your verification process?
Customer: No, nothing has changed. I've been using this same verification process without problems for a long time.
Agent: That's very strange. Let me check something... I'm seeing that our system flagged your verification process for verification after a security check last month. That's why the wire transfers are failing.
Customer: Why wasn't I notified about this? And why didn't the other agents see this?
Agent: I sincerely apologize. This should have been communicated to you. I can verify your verification process right now, which will resolve the issue.
Customer: I still want to speak with a supervisor. This has been incredibly frustrating and I want to file a formal complaint.
Agent: Absolutely, you have every right to speak with a supervisor. Let me get your verification process verified first so we can prevent any further issues, and then I'll transfer you directly to my supervisor."
6804-5262-6553-9250,Reservation Modifications,[Reason],"Agent: Good afternoon, StayComfort front desk. This is Emily. How may I help you?
Customer: I'm actually at your front desk right now and there's a major problem. I have a confirmed reservation but this is not the view I paid for.
Agent: I apologize for the confusion. Let me pull up your reservation. Can I have your last name and confirmation number?
Customer: It's Cynthia Edwards. Confirmation number is 772553.
Agent: Thank you Mr./Ms. Edwards. I see your reservation here. You booked a double queen with city view. Let me see what happened...
Customer: Yes, exactly. I booked this weeks ago and paid extra for the standard tier. This is not what I reserved.
Agent: I see the issue now. There was a upgrade mix-up in our system that affected several reservations today. I'm very sorry about this. Let me find you the correct room right away.
Customer: I'm traveling with my family and we specifically chose this room for the city view. Can you actually fix this?
Agent: Absolutely. I have a double queen with city view available on the 20th floor. It's actually one of our newly renovated rooms, so it's even nicer. I'm moving your reservation to that room right now at no additional cost.
Customer: Okay, that sounds better. But this was really frustrating. I've been traveling all day.
Agent: I completely understand, and I'm very sorry for the inconvenience. I'm also going to comp your resort fees for your entire stay as an apology. Your new room keys will be ready in just a moment.
Customer: Thank you. I appreciate you taking care of this quickly.
Agent: You're very welcome. Here are your new keys for room 2065. If you need anything else during your stay, please don't hesitate to call the front desk. Enjoy your stay!"
2631-3093-2546-3092,Business Event - Ransomware Attack,[Reason],"Agent: City Hospital Crisis Line, this is Victoria. We're experiencing a cybersecurity incident.
Customer: I just got a text saying my surgery scheduled for tomorrow is cancelled. Why? I've been waiting three months for this.
Agent: I'm very sorry. The hospital was hit by a ransomware attack last night. Our electronic health record systems are completely offline.
Customer: Ransomware? Does that mean hackers have my medical records?
Agent: We're investigating the extent of data access. Right now, we know our systems are encrypted and we cannot access patient records electronically.
Customer: But you still have my records, right? You can still do my surgery?
Agent: We have paper backups, but without computer access, we cannot safely perform elective surgeries. We're only handling emergency cases.
Customer: Elective? This is knee replacement surgery. I can barely walk!
Agent: I understand, and I'm very sorry. 'Elective' means it's scheduled in advance, not that it's optional. We've had to reschedule all non-emergency procedures.
Customer: For how long? When can I have my surgery?
Agent: We're hoping to restore systems within one week. You'll be our first priority for rescheduling once we're operational.
Customer: One week? I've taken time off work, arranged care for my kids. This is a disaster.
Agent: I completely understand your frustration. The hospital is covering any costs you've incurred for your preparations.
Customer: Costs? What about my vacation days? My lost wages?
Agent: Our patient advocate team is documenting all impacts. The hospital will work with affected patients on appropriate compensation.
Customer: Did the hackers access my social security number? My insurance information?
Agent: We don't know yet. We're offering free credit monitoring and identity theft protection to all patients as a precaution.
Customer: As a precaution? That means you think they got the data.
Agent: We're taking every security measure seriously. Cybersecurity experts and the FBI are investigating. You'll receive detailed notification letters.
Customer: The FBI? This is that serious?
Agent: Yes. Ransomware attacks on hospitals are federal crimes. Law enforcement is fully involved.
Customer: Can I go to a different hospital for my surgery?
Agent: Yes, absolutely. We can facilitate transfer of your care. I can help coordinate that if you'd like.
Customer: I've been seeing Dr. Peters for years. I trust him. I don't want a different surgeon.
Agent: Dr. Peters has privileges at County Medical Center. He could potentially perform your surgery there. Would you like me to contact his office?
Customer: Yes, please. I need this surgery soon.
Agent: I'm connecting with Dr. Peters' office now to arrange that. You'll receive a call within two hours about scheduling."
2279-6378-9180-5134,Fraud Alert Investigation,[Reason],"Agent: Thank you for calling ShieldCorp Fraud Department. This is William. How can I help you?
Customer: I just got a fraud alert about a charge on my account. I wanted to verify if it's legitimate.
Agent: Absolutely, I can help you with that. Can I get your card number and verify your identity?
Customer: Sure, the last four digits are 9110. My name is Kelly Anderson.
Agent: Thank you. I see the alert on your account. There's a charge for $1,245.00 at a hotel in Nevada. Did you make this purchase?
Customer: No, I definitely did not. I've never been to Nevada, and I haven't made any online purchases recently.
Agent: Understood. I'm marking this transaction as fraudulent right now and blocking your current card. The charge will be reversed within 5-7 business days.
Customer: Thank you. How did someone get my card information?
Agent: Unfortunately, card information can be compromised in several ways - data breaches, skimming devices, or phishing. The important thing is we caught it quickly. I'm issuing you a new card with expedited shipping. You should receive it in 2-3 business days.
Customer: What about my automatic payments? I have bills set up on this card.
Agent: Good question. I recommend updating those as soon as you receive your new card. In the meantime, I can note which merchants you have recurring payments with, and we'll ensure those go through while we transition you to the new card.
Customer: Okay, thank you. Is there anything else I should do?
Agent: I recommend monitoring your account closely for the next few weeks. We've also added extra security monitoring. If you see anything suspicious, call us immediately. Is there anything else I can help you with?
Customer: No, that's all. Thank you for your help."
7739-3420-5215-7211,Update Failures,[Reason],"Agent: Thank you for contacting TechPro Software Support. This is Tyler. How can I help you?
Customer: Hi, I updated my design software yesterday and now it won't open. It crashes every single time I try to launch it.
Agent: I'm sorry you're experiencing crashes. That's definitely frustrating, especially if you have work to do. What operating system are you using?
Customer: I'm on Windows 11. Everything was working perfectly before this update.
Agent: Understood. When you try to open the software, does it show any error message before crashing?
Customer: There's a brief message that flashes about graphics, but it disappears too fast for me to read the whole thing.
Agent: That's helpful information. The latest update includes new rendering features that require specific graphics drivers. Can you tell me what graphics card you have?
Customer: I'm not sure. How would I find that?
Agent: No problem. Right-click on the Windows Start button and select Device Manager.
Customer: Okay, I have it open.
Agent: Look for 'Display adapters' and click the arrow next to it to expand. What's listed there?
Customer: It says AMD Radeon RX 6700 XT.
Agent: Perfect. That's a very capable card. Now right-click on that entry and select Properties.
Customer: Done.
Agent: Click on the Driver tab and tell me what version number you see.
Customer: It shows version 30.0.15010.1004 from September 2024.
Agent: There's your issue. That driver version has a known compatibility problem with our latest update. AMD released a fix in late October that resolves this.
Customer: So I just need to update my graphics driver?
Agent: Exactly. I'll walk you through it step by step. Open your web browser and go to AMD.com/support.
Customer: Okay, I'm there.
Agent: Click on 'Download Drivers' and then select 'Graphics' from the product menu.
Customer: Got it.
Agent: Now select 'Radeon RX 6000 Series' and then 'RX 6700 XT' from the dropdowns.
Customer: Okay, and Windows 11 for the operating system?
Agent: Correct. Now click Submit.
Customer: It's showing AMD Software version 24.10.1. Is that the right one?
Agent: Yes, that's the version we need. Click Download.
Customer: It's downloading now. This file is pretty large.
Agent: Yes, it's typically around 600 megabytes. While that's downloading, have you lost any work in the software, or were you able to save before the crashes started?
Customer: Thankfully I had saved everything before updating. I learned that lesson the hard way once before.
Agent: Smart! Your files are safe then. How's the download progressing?
Customer: It just finished.
Agent: Great. Double-click the downloaded file to run the installer.
Customer: It's asking if I want to allow this app to make changes. I should click Yes?
Agent: Yes, that's normal for driver installations.
Customer: Okay, the AMD installer is now open.
Agent: You'll see options for Express or Custom installation. Select Express - it will automatically install the recommended components.
Customer: Alright, installing now... My screen just flickered.
Agent: That's completely normal. Your display is adjusting as the new driver is being installed.
Customer: Okay good, I was worried something went wrong. The installation is about halfway done.
Agent: Once it finishes, you'll need to restart your computer for the changes to take full effect.
Customer: The installation just completed. It says restart required.
Agent: Perfect. Go ahead and restart. Would you like me to call you back in about five minutes to confirm everything is working?
Customer: That would be great. My number is 555-7392.
Agent: Got it. I'll call you back shortly. Go ahead and restart now.
Customer: Thanks, talk to you soon.
Agent: [After callback] Hi, this is {agent.split()[0]} calling back from TechPro. Did your computer restart okay?
Customer: Yes, everything's back up.
Agent: Excellent. Try opening the design software now.
Customer: Okay, launching it... Oh wow, it opened! No crash! I can see all my recent projects.
Agent: That's wonderful! Try opening one of your files to make sure everything is fully functional.
Customer: Opening my main project now... Yes! Everything loaded perfectly. All my layers are intact and the tools are responding normally.
Agent: Perfect! You should be all set now. The new driver is fully compatible with our latest software version.
Customer: Thank you so much. I was panicking because I have a client deadline tomorrow.
Agent: I'm glad we could get you back up and running quickly. For future reference, we've added a notification on our update page about this driver requirement.
Customer: Good to know. Are there any new features I should be aware of in this update?
Agent: The main improvements are faster rendering speeds and some new brush presets. There's a quick tutorial on our website if you want to explore them.
Customer: I'll check that out. Thanks again for your help!
Agent: You're very welcome. Good luck with your deadline!"
6405-7726-8648-1932,Appointment Scheduling,[Reason],"Agent: Thank you for calling MediPlus. This is Mark. How can I help you?
Customer: Hi, I have an appointment with Dr. Williams next Tuesday at 3:30 PM, but I need to reschedule it. a family emergency came up.
Agent: I understand. Let me help you reschedule. Can I get your name and date of birth for verification?
Customer: It's Kyle Powell, and my date of birth is 2/21/1981.
Agent: Thank you. I see your appointment here for the diagnostic evaluation. Let me check Dr. Williams's availability. When would work better for you?
Customer: Ideally sometime next week, but any day except next Tuesday would work.
Agent: Let me see what's available... Dr. Williams has openings on next Friday at 9:30 AM. Would either of those work?
Customer: The morning time works better for me.
Agent: Perfect. I'm moving your appointment to that slot. You'll receive a confirmation email and text message with the new date and time.
Customer: Great, thank you. Will I need to do anything special for this diagnostic evaluation?
Agent: For the diagnostic evaluation, please arrive 15 minutes early to complete any necessary paperwork. If you're on any medications, bring a current list. Also, avoid eating for 12 hours before the appointment.
Customer: Okay, I'll make sure to do that. Thank you for your help.
Agent: You're welcome! If you need to make any changes, just give us a call at least 24 hours in advance. Is there anything else I can help you with today?
Customer: No, that's all. Thank you!"
8472-9476-6414-5784,"Multiple Issues - Reservation, Service & Amenities",[Reason],"Agent: TelecomPlus. This is Joshua. How may I assist you?
Customer: I need to extend my reservation by two nights, report an issue with my room, and ask about your spa services.
Agent: I'll be happy to help with all three. Can I get your reservation number?
Customer: It's 212623.
Agent: Thank you. I see you're currently in room 361 with a ocean view suite. You're scheduled to check out on Sunday. You'd like to extend through Tuesday?
Customer: Yes, that's correct. Also, the air conditioning in my room isn't working properly.
Agent: I apologize for that. I'm sending maintenance to your room right now. If they can't fix it immediately, would you like us to move you to a comparable room?
Customer: Let's see if they can fix it first. Now, do you have spa services available?
Agent: Yes, our spa is open daily from 9 AM to 8 PM. We offer massages, facials, and body treatments. Would you like me to make a reservation?
Customer: Can I get a massage tomorrow afternoon?
Agent: Absolutely. I have availability at 2 PM or 4 PM for a 90-minute session.
Customer: 2 PM works. And the room extension?
Agent: Confirmed for two additional nights at the same rate. Maintenance should be at your room within 15 minutes. Anything else?
Customer: No, that's everything. Thank you!"
2201-9772-7299-1096,Business Event - Cyber Attack,[Reason],"Agent: NetConnect Emergency Response, this is Roger. We're currently experiencing a service disruption.
Customer: My internet has been down for two hours. I'm trying to work and I can't access anything. What's going on?
Agent: We're experiencing a distributed denial-of-service attack on our network infrastructure. It's affecting customers across five states.
Customer: A cyber attack? Is my personal information at risk?
Agent: No, this is a DDoS attack which targets our network capacity, not customer data. Your personal information is secure.
Customer: When will service be restored? I have a presentation in three hours.
Agent: Our security team is actively mitigating the attack. We expect partial restoration within one hour and full service within four hours.
Customer: Four hours? That's after my presentation. This could cost me a major client.
Agent: I understand the urgency. We're offering affected business customers complimentary mobile hotspots for immediate connectivity.
Customer: How quickly can I get one?
Agent: We have courier service dispatching them right now. Where are you located?
Customer: Downtown business district, 423 Commerce Street.
Agent: Perfect. A hotspot can be delivered to you within 45 minutes with unlimited data for the next week.
Customer: That might work. Will it be fast enough for video conferencing?
Agent: Yes, the hotspots support up to 50 megabits which is sufficient for HD video calls. We're also providing automatic bill credits.
Customer: How much credit?
Agent: All affected customers will receive one full month of service credit automatically applied within 48 hours.
Customer: Has this type of attack happened before? Should I be worried about switching providers?
Agent: This is the first successful attack of this magnitude on our network. We're implementing enhanced DDoS protection that will be active by next week.
Customer: Are you tracking who's responsible?
Agent: Yes, we're working with federal law enforcement and cybersecurity agencies. The FBI has been notified and is investigating.
Customer: Alright, please send that hotspot quickly. I really need it for this meeting.
Agent: It's being dispatched now. You'll receive a text with tracking in about 10 minutes. Is there anything else I can help with?
Customer: No, just get my internet working again.
Agent: We're doing everything we can. Thank you for your patience during this attack."
